{
  "$schema": "https://json-schema.org/draft/2020-12/schema",
  "$id": "https://plugins.ahaslides.com/schema/plugin-manifest.schema.json",
  "title": "Plugin Manifest",
  "description": "Manifest describing an AhaSlides slide plugin.",
  "type": "object",
  "required": ["id", "name", "baseUrl", "staticTabs"],
  "additionalProperties": false,
  "properties": {
    "$schema": {
      "type": "string",
      "description": "URL of this manifest's JSON Schema, used by editors for autocompletion and validation."
    },
    "id": {
      "type": "string",
      "description": "Unique plugin identifier (kebab-case).",
      "pattern": "^[a-z0-9]+(?:-[a-z0-9]+)*$",
      "minLength": 1
    },
    "name": {
      "type": "string",
      "description": "Human-readable plugin name shown in the UI.",
      "minLength": 1
    },
    "icon": {
      "type": "string",
      "description": "Absolute or relative path to the plugin icon asset.",
      "minLength": 1
    },
    "baseUrl": {
      "type": "string",
      "description": "Base URL where the plugin is hosted. Supports `{{VAR}}` template placeholders resolved at runtime.",
      "minLength": 1
    },
    "staticTabs": {
      "type": "array",
      "description": "Tabs registered by the plugin at fixed contexts.",
      "minItems": 1,
      "items": { "$ref": "#/$defs/staticTab" }
    },
    "slideTypes": {
      "type": "array",
      "description": "Custom slide types registered by the plugin. Each entry appears in the host slide selector and provides the iframe URLs for the editor settings, presenter canvas, and audience views.",
      "items": { "$ref": "#/$defs/slideType" }
    }
  },
  "$defs": {
    "staticTab": {
      "type": "object",
      "required": ["contentUrl", "context"],
      "additionalProperties": false,
      "properties": {
        "contentUrl": {
          "type": "string",
          "description": "URL path (relative to `baseUrl`) rendered inside the tab.",
          "minLength": 1
        },
        "context": {
          "type": "string",
          "description": "Where this tab is shown inside the host app.",
          "enum": ["home", "editor", "presenter", "audience", "report"]
        },
        "name": {
          "type": "string",
          "description": "Optional display name for the tab.",
          "minLength": 1
        },
        "type": {
          "type": "string",
          "description": "How the tab is opened.",
          "enum": ["popup"]
        }
      }
    },
    "slideType": {
      "type": "object",
      "required": ["type", "name", "canvasUrl", "settingUrl", "audienceUrl"],
      "additionalProperties": false,
      "properties": {
        "type": {
          "type": "string",
          "description": "Unique slide-type identifier. Stored on the slide as `slide.type`. Should not collide with built-in slide types.",
          "pattern": "^[a-zA-Z0-9][a-zA-Z0-9_-]*$",
          "minLength": 1
        },
        "name": {
          "type": "string",
          "description": "Human-readable slide-type name shown in the slide selector.",
          "minLength": 1
        },
        "desc": {
          "type": "string",
          "description": "Short description shown in the slide selector."
        },
        "icon": {
          "type": "string",
          "description": "Absolute or relative path to the slide-type icon asset."
        },
        "previewUrl": {
          "type": "string",
          "description": "Optional preview image/video URL shown when hovering the slide type."
        },
        "canvasUrl": {
          "type": "string",
          "description": "Absolute URL of the iframe rendered on the presenter canvas. Supports `{{VAR}}` template placeholders.",
          "minLength": 1
        },
        "settingUrl": {
          "type": "string",
          "description": "Absolute URL of the iframe rendered in the editor settings panel. Supports `{{VAR}}` template placeholders.",
          "minLength": 1
        },
        "audienceUrl": {
          "type": "string",
          "description": "Absolute URL of the iframe rendered for participants in the audience app. Supports `{{VAR}}` template placeholders.",
          "minLength": 1
        },
        "setting": {
          "type": "object",
          "description": "Optional UI capability flags consumed by the host's editor settings panel. Missing keys fall back to host defaults.",
          "additionalProperties": false,
          "properties": {
            "enableQuestionTitle": { "type": "boolean" },
            "enableQuestionDescription": { "type": "boolean" },
            "enableTimeLimit": { "type": "boolean" },
            "enableStopSubmitssionSetting": { "type": "boolean" },
            "enableHideResultSetting": { "type": "boolean" },
            "enableQuestionImage": { "type": "boolean" },
            "enableVoteCount": { "type": "boolean" },
            "enableLabelOtherSetting": { "type": "boolean" },
            "enableMultipleSubmission": { "type": "boolean" },
            "enableFullScreen": { "type": "boolean" },
            "enableFullScreenFrame": { "type": "boolean" },
            "enableIframePreload": { "type": "boolean" },
            "enableQuizSetting": {
              "type": "boolean",
              "description": "When true, the host's editor settings panel shows the native quiz settings cluster for this slide (Points max/min, Faster answers get more points, Time limit, Leaderboard toggle, and General quiz settings). Set this on scored / quiz-style slide types so they reuse the host's scoring controls instead of rebuilding them."
            }
          }
        },
        "thumbnail": {
          "type": "object",
          "description": "Left-panel thumbnail behaviour for this slide type in the presenter editor.",
          "additionalProperties": false,
          "required": ["mode"],
          "properties": {
            "mode": {
              "type": "string",
              "enum": ["icon", "iframe"],
              "default": "icon",
              "description": "icon = slide-type icon (default); iframe = the host mounts `iframeUrl/<slideId>` in a plain iframe inside the slide row and feeds it the slide attributes + deck theme over postMessage (`aha:slide-preview:update` / `aha:slide-preview:ready`)."
            },
            "iframeUrl": {
              "type": "string",
              "description": "Absolute base URL of the static preview page; the host appends `/<slideId>`. Required when mode = iframe.",
              "minLength": 1
            },
            "attributeKeys": {
              "type": "array",
              "items": { "type": "string", "minLength": 1 },
              "description": "Slide attribute keys the host must load and forward to the preview iframe (mode = iframe), e.g. [\"dsl\"]."
            }
          },
          "allOf": [
            {
              "if": { "properties": { "mode": { "const": "iframe" } } },
              "then": { "required": ["iframeUrl"] }
            }
          ]
        }
      }
    }
  }
}
