{
  "$schema": "https://plugins.ahaslides.com/schema/plugin-manifest.schema.json",
  "id": "aha-survey",
  "name": "Survey",
  "icon": "/icons/system-form.svg",
  "baseUrl": "{{VITE_PUBLIC_BASE_URL}}",
  "staticTabs": [
    {
      "contentUrl": "/",
      "context": "home"
    },
    {
      "contentUrl": "/",
      "context": "editor",
      "name": "Survey"
    }
  ]
}
